25201671,1544-5208,2014,Health affairs (Project Hope),Health Aff (Millwood),United States,4.98,4.523,5.626,The Affordable Care Act reduces emergency department use by young adults: evidence from three States.,17,"( AHRQ HHS / United States ) , ( NIDDK NIH HHS / United States )","Insurance Coverage < Insurance, Health Reform, Access To Care",Health Care Sciences & Services,Health Care Sciences & Services; Health Policy & Services,"Male, Patient Protection and Affordable Care Act, Florida, Humans, (Insurance Coverage/statistics & numerical data), New York, California, Adult, Female, (Emergency Service, Hospital/utilization)",5,1,20.00,No,No
25193898,1319-2442,2014,"Saudi journal of kidney diseases and transplantation : an official publication of the Saudi Center for Organ Transplantation, Saudi Arabia",Saudi J Kidney Dis Transpl,Saudi Arabia,,,,"Comparison of the performance of the updated Schwartz, combined Schwartz and the Grubb glomerular filtration rate equations in a general pediatric population.",,-,-,,,"(Iran/epidemiology), Age Factors, Adolescent, Humans, Models, Biological, (Creatinine/blood), Predictive Value of Tests, (Cystatin C/blood), Glomerular Filtration Rate, (Biomarkers/blood), (Renal Insufficiency, Chronic/blood/diagnosis/epidemiology/physiopathology), Child, Blood Urea Nitrogen, (Kidney/physiopathology), Reproducibility of Results, Reference Values",7,1,14.29,No,No
25179420,1557-9700,2014,"Psychiatric services (Washington, D.C.)",Psychiatr Serv,United States,2.888,2.643,3.103,The subjective experience of youths at clinically high risk of psychosis: a qualitative study.,10,"( NIMH NIH HHS / United States ) , ( NCRR NIH HHS / United States )",-,"Health Care Sciences & Services; Public, Environmental & Occupational Health; Psychiatry","Health Policy & Services; Public, Environmental & Occupational Health; Psychiatry","(Interview, Psychological/methods), Young Adult, Schizophrenic Psychology, (Schizophrenia/complications/diagnosis), Risk Assessment, (Symptom Assessment/methods), Humans, Patient Acuity, Sex Factors, Social Adjustment, Adult, Female, (Psychotic Disorders/diagnosis/etiology/psychology), Male, Prodromal Symptoms",10,1,10.00,No,No
25177616,2249-782X,2014,Journal of clinical and diagnostic research : JCDR,J Clin Diagn Res,India,,,,Congential lumbar hernia with malrotation of left kidney and hydronephrosis in an infant: a rare presentation.,,-,"Scoliosis, Malrotation, Renal anomaly, Lung hypoplasia",,,-,3,1,33.33,No,No
25177586,2249-782X,2014,Journal of clinical and diagnostic research : JCDR,J Clin Diagn Res,India,,,,Recognizing changes in cognition in sub types of acute confusional state.,,-,"Psychosis, Neuropsychiatric syndrome, MMSE",,,-,5,1,20.00,No,No
27331182,2452-2473,2014,Turkish journal of emergency medicine,Turk J Emerg Med,Turkey,,,,Evaluation of Prevalence of Low Back Pain Among Residents of Tabriz University of Medical Sciences in Relation with Their Position in Work.,,-,"resident, position, Low back pain",,,-,4,1,25.00,No,No
25161987,2277-9175,2014,Advanced biomedical research,Adv Biomed Res,India,,,,The effects of multi-strain probiotic compound on symptoms and quality-of-life in patients with irritable bowel syndrome: A randomized placebo-controlled trial.,,-,"therapy, Irritable bowel syndrome, probiotics",,,-,8,1,12.50,No,No
25149888,1735-9694,2014,Acta medica Iranica,Acta Med Iran,Iran,,,,Evaluating the quality of the educational environment for medical interns in an emergency department using the DREEM inventory.,,-,-,,,"Iran, Learning, Surveys and Questionnaires, (Internship and Residency/organization & administration/standards), Students, Medical, Humans, Cross-Sectional Studies, Female, (Emergency Service, Hospital/organization & administration), Male, (Education, Medical, Undergraduate/organization & administration/standards)",7,1,14.29,No,No
25133341,1538-8654,2014,Advances in skin & wound care,Adv Skin Wound Care,United States,1.088,0.955,1.658,Wounds in patients with HIV.,1,( NIDDK NIH HHS / United States ),-,Dermatology; Nursing; Surgery,Dermatology; Nursing; Surgery,"Electronic Health Records, Adolescent, Quality of Life, (HIV Seropositivity/epidemiology), Incidence, Humans, (Wounds and Injuries/epidemiology), Retrospective Studies, (Varicose Ulcer/epidemiology), Adult, Female, Male, (Pressure Ulcer/epidemiology), (Postoperative Complications/epidemiology), Risk Factors",7,1,14.29,No,No
25133072,2159-2896,2014,International journal of sports physical therapy,Int J Sports Phys Ther,United States,,,,Effects of postural control manipulation on visuomotor training performance: comparative data in healthy athletes.,,-,"postural control, concussion, Balance, vestibular, Dynavision™",,,-,8,1,12.50,No,No
25121786,1527-330X,2014,Aesthetic surgery journal,Aesthet Surg J,England,2.697,1.792,2.602,Anatomy of the sternal origin of the pectoralis major: implications for subpectoral augmentation.,4,-,"subpectoral, sternal origin, subpectoral augmentation, Pectoralis major",Surgery,Surgery,"Breast Implantation, Middle Aged, Humans, Cadaver, Aged, 80 and over, Female, (Sternum/anatomy & histology), Aged, Mammaplasty, (Pectoralis Muscles/anatomy & histology), (Body Weights and Measures/methods)",4,1,25.00,No,No
25121785,1527-330X,2014,Aesthetic surgery journal,Aesthet Surg J,England,2.697,1.792,2.602,Will 1-stage implant salvage after periprosthetic breast infection ever be routine? A 6-year successful experience.,6,-,"MRSA, periprosthetic infection, 1-stage implant salvage, biofilm, sequential cleaning, breast augmentation, capsular contracture",Surgery,Surgery,"Young Adult, (Anti-Bacterial Agents/therapeutic use), (Mammaplasty/adverse effects), (Breast/surgery), Humans, (Prosthesis-Related Infections/drug therapy/surgery), (Breast Implants/adverse effects), Retrospective Studies, Adult, Female, Middle Aged, (Breast Diseases/drug therapy/surgery), Follow-Up Studies",4,4,100.00,Yes,Yes
25121784,1527-330X,2014,Aesthetic surgery journal,Aesthet Surg J,England,2.697,1.792,2.602,Effectiveness of prophylactic antibiotics in outpatient plastic surgery.,3,-,"outpatient surgery, prophylaxis, antibiotics, complications, comorbidities",Surgery,Surgery,"Surgery, Plastic, Male, Female, Adolescent, Humans, (Antibiotic Prophylaxis/methods/statistics & numerical data), (Anti-Bacterial Agents/therapeutic use), Risk Factors, Cosmetic Techniques, Young Adult, (Surgical Wound Infection/prevention & control), Adult, (Ambulatory Surgical Procedures/methods/statistics & numerical data), Middle Aged, Treatment Outcome, Aged, (Reconstructive Surgical Procedures/statistics & numerical data), Retrospective Studies, Texas, (Postoperative Complications/prevention & control)",10,6,60.00,Yes,No
25121019,2249-782X,2014,Journal of clinical and diagnostic research : JCDR,J Clin Diagn Res,India,,,,"High blood pressure in dialysis patients: cause, pathophysiology, influence on morbidity, mortality and management.",,-,"Chronic kidney disease, Hypertension, Mortality, Dialysis, Blood pressure",,,-,5,1,20.00,No,No
25121014,2249-782X,2014,Journal of clinical and diagnostic research : JCDR,J Clin Diagn Res,India,,,,"Microbiological Profile and Drug Sensitivity Pattern among Community Acquired Pneumonia Patients in Tertiary Care Centre in Mangalore, Coastal Karnataka, India.",,-,"Drug sensitivity, Coastal southern india, Community acquired pneumonia, Microbiological profile",,,-,6,1,16.67,No,No
25102347,1533-9866,2014,Obstetrical & gynecological survey,Obstet Gynecol Surv,United States,1.565,1.536,2.573,"Umbilical artery aneurysm: a case report, literature review, and management recommendations.",4,-,-,Obstetrics & Gynecology,Obstetrics & Gynecology,"Pregnancy Trimester, Third, Genetic Counseling, Pregnancy Trimester, Second, (Pregnancy Complications/diagnostic imaging/therapy), Humans, Umbilical Arteries, (Aneurysm/diagnostic imaging/therapy), Karyotyping, Pregnancy, Ultrasonography, Prenatal, Adult, Female, Cesarean Section, Infant, Newborn",5,1,20.00,No,No
25102346,1533-9866,2014,Obstetrical & gynecological survey,Obstet Gynecol Surv,United States,1.565,1.536,2.573,"Fetal endoscopic tracheal occlusion for congenital diaphragmatic hernia: indications, outcomes, and future directions.",5,-,-,Obstetrics & Gynecology,Obstetrics & Gynecology,"(Hernias, Diaphragmatic, Congenital/diagnostic imaging/epidemiology/surgery), Severity of Illness Index, (Endoscopy/methods), (Lung/abnormalities), Humans, (Hypertension, Pulmonary/prevention & control), Prognosis, Ultrasonography, Prenatal, (Abnormalities, Multiple/prevention & control), (Fetal Diseases/diagnostic imaging/epidemiology/surgery), (Lung Diseases/prevention & control)",6,2,33.33,No,No
25102019,1533-9866,2013,Obstetrical & gynecological survey,Obstet Gynecol Surv,United States,1.565,1.536,2.573,Association between mental stress and gestational hypertension/preeclampsia: a meta-analysis.,12,-,-,Obstetrics & Gynecology,Obstetrics & Gynecology,"Humans, (Hypertension, Pregnancy-Induced/etiology/psychology), Pregnancy, Female, (Stress, Psychological/complications), (Pre-Eclampsia/etiology/psychology), Risk Factors",7,3,42.86,No,No
25101844,1533-9866,2014,Obstetrical & gynecological survey,Obstet Gynecol Surv,United States,1.565,1.536,2.573,Controversies in the management of hypothyroidism during pregnancy.,2,-,-,Obstetrics & Gynecology,Obstetrics & Gynecology,"(Thyroid Gland/physiology), Practice Guidelines as Topic, (Iodine/deficiency), (Autoantibodies/blood), Humans, (Pregnancy Complications/diagnosis/drug therapy/immunology), (Asymptomatic Diseases/therapy), Pregnancy Trimesters, (Immunoglobulins, Thyroid-Stimulating/blood), Female, Pregnancy, (Thyroxine/blood/therapeutic use), (Hypothyroidism/diagnosis/drug therapy/immunology), (Thyrotropin/blood)",4,1,25.00,No,No
25101843,1533-9866,2014,Obstetrical & gynecological survey,Obstet Gynecol Surv,United States,1.565,1.536,2.573,Isolated unilateral pulmonary agenesis and other fetal thoracic anomalies.,2,-,-,Obstetrics & Gynecology,Obstetrics & Gynecology,"(Lung Diseases/diagnosis/epidemiology/therapy), (Lung/abnormalities), Humans, Diagnosis, Differential, Prognosis, Ultrasonography, Prenatal, Adult, Female, Pregnancy, Magnetic Resonance Imaging, (Abnormalities, Multiple/diagnosis/epidemiology/therapy)",3,1,33.33,Yes,No
25101694,1533-9866,2014,Obstetrical & gynecological survey,Obstet Gynecol Surv,United States,1.565,1.536,2.573,Long-term consequences of the posterior reversible encephalopathy syndrome in eclampsia and preeclampsia: a review of the obstetric and nonobstetric literature.,13,-,-,Obstetrics & Gynecology,Obstetrics & Gynecology,"Time Factors, (Eclampsia/epidemiology), (Posterior Leukoencephalopathy Syndrome/complications/diagnosis/epidemiology), Humans, Neuroimaging, Tomography, X-Ray Computed, (Cognition Disorders/epidemiology), Female, (Vision Disorders/epidemiology), Pregnancy, (Pre-Eclampsia/epidemiology), Magnetic Resonance Imaging, (Epilepsy/epidemiology)",5,1,20.00,No,No
25101693,1533-9866,2014,Obstetrical & gynecological survey,Obstet Gynecol Surv,United States,1.565,1.536,2.573,Cancer and pregnancy: the clinician's perspective.,4,-,-,Obstetrics & Gynecology,Obstetrics & Gynecology,"(Thyroid Neoplasms/diagnosis/surgery), (Pregnancy Complications, Neoplastic/diagnosis/therapy), Humans, (Skin Neoplasms/diagnosis/pathology/surgery), (Hematologic Neoplasms/diagnosis/drug therapy), Pregnancy, Female, (Breast Neoplasms/epidemiology/pathology/therapy), Neoplasm Staging, Delivery, Obstetric, (Melanoma/diagnosis/secondary/surgery), (Colonic Neoplasms/diagnosis/therapy)",4,1,25.00,No,No
25097645,1735-3327,2014,Dental research journal,Dent Res J (Isfahan),Iran,,,,Effect of 0.2% chlorhexidine on microbial and fungal contamination of dental unit waterlines.,,-,"infection control, dental, chlorhexidine, Antibacterial, antifungal",,,-,6,1,16.67,No,No
25097598,1735-1995,2014,Journal of research in medical sciences : the official journal of Isfahan University of Medical Sciences,J Res Med Sci,India,1.237,1.133,1.133,The effect of salsalate on biochemical factors and endothelial dysfunction of prediabetic patients: A randomized clinical trial.,3,-,"salsalate, endothelial function, Diabetes",General & Internal Medicine,"Medicine, General & Internal",-,3,1,33.33,Yes,No
25097432,0976-9668,2014,"Journal of natural science, biology, and medicine",J Nat Sci Biol Med,India,,,,Incorporation of web-based applications and online resources in undergraduate medical education in the Irish Republic. Can new changes be incorporated in the current medical curriculum?,,-,"technology gap, web-based applications, medical education, Information technology",,,-,2,1,50.00,Yes,No
25096822,1421-9867,2014,Digestion,Digestion,Switzerland,2.088,1.97,2.201,Prevalence of lactose intolerance in Chile: a double-blind placebo study.,10,-,-,Gastroenterology & Hepatology,Gastroenterology & Hepatology,"Lactose Tolerance Test, Male, (Lactose/administration & dosage), (Lactose Intolerance/epidemiology/ethnology/genetics), Genotype, Adolescent, (Lactase/genetics), Gene Frequency, Humans, Young Adult, Adult, Female, Prevalence, (Chile/epidemiology), Double-Blind Method, Prospective Studies",10,1,10.00,Yes,No
25092832,1544-5208,2014,Health affairs (Project Hope),Health Aff (Millwood),United States,4.98,4.523,5.626,California emergency department closures are associated with increased inpatient mortality at nearby hospitals.,7,( NCATS NIH HHS / United States ),Organization and Delivery of Care,Health Care Sciences & Services,Health Care Sciences & Services; Health Policy & Services,"Young Adult, (Patient Admission/statistics & numerical data), Middle Aged, Humans, (Hospital Mortality/trends), California, Adult, (Emergency Service, Hospital/organization & administration), Health Facility Closure, Aged, Retrospective Studies",3,1,33.33,Yes,No
25086082,0315-162X,2014,The Journal of rheumatology,J. Rheumatol.,Canada,3.15,2.903,3.293,Prolonged clinical remission in patients with systemic lupus erythematosus.,18,-,"SLE, SEROLOGIC ACTIVITY, DISEASE ACTIVITY, OUTCOMES",Rheumatology,Rheumatology,"Male, Case-Control Studies, (Lupus Erythematosus, Systemic/diagnosis/drug therapy/immunology), Adolescent, Middle Aged, Humans, Recurrence, Severity of Illness Index, (Immunosuppressive Agents/therapeutic use), Adult, Female, Young Adult, Aged, Follow-Up Studies",5,1,20.00,No,No
25086076,0315-162X,2014,The Journal of rheumatology,J. Rheumatol.,Canada,3.15,2.903,3.293,Predictors for mortality in patients with antineutrophil cytoplasmic autoantibody-associated vasculitis: a study of 398 Chinese patients.,11,-,"SECONDARY INFECTION, ANTINEUTROPHIL CYTOPLASMIC AUTOANTIBODY, PREDICTORS, MORTALITY, VASCULITIS",Rheumatology,Rheumatology,"(Anti-Neutrophil Cytoplasmic Antibody-Associated Vasculitis/drug therapy/mortality), Male, Middle Aged, Humans, Prognosis, (Coinfection/mortality), Female, Aged, (Immunosuppressive Agents/therapeutic use), Retrospective Studies, (China/epidemiology)",6,6,100.00,Yes,Yes
25083955,2327-2228,2014,Rhode Island medical journal (2013),R I Med J (2013),United States,,,,Epstein-Barr virus associated hemophagocytic lymphohistiocytosis in a rheumatic patient receiving abatacept therapy.,,-,"rheumatoid arthritis, Epstein-Barr virus, abatacept, Hemophagocytic lymphohistiocytosis",,,"Abatacept, (Immunoconjugates/therapeutic use), (Antirheumatic Agents/therapeutic use), Middle Aged, Epstein-Barr Virus Infections, Humans, Fatal Outcome, (Lymphohistiocytosis, Hemophagocytic/virology), Male, (Arthritis, Rheumatoid/drug therapy)",4,1,25.00,Yes,No
25078043,1538-9766,2014,Gastroenterology nursing : the official journal of the Society of Gastroenterology Nurses and Associates,Gastroenterol Nurs,United States,0.671,0.602,0.872,The effectiveness of a structured educational intervention on disease-related misconception and quality of life in patients with irritable bowel syndrome.,1,-,-,Gastroenterology & Hepatology; Nursing,Gastroenterology & Hepatology; Nursing,"(Irritable Bowel Syndrome/psychology/therapy), Quality of Life, Middle Aged, Humans, Adult, Female, Male, (Patient Education as Topic/methods)",5,2,40.00,No,No
25076199,1938-808X,2014,Academic medicine : journal of the Association of American Medical Colleges,Acad Med,United States,5.255,4.453,4.901,Community college pathways: improving the U.S. physician workforce pipeline.,7,"( NCATS NIH HHS / United States ) , ( NIA NIH HHS / United States )",-,Education & Educational Research; Health Care Sciences & Services,"Education, Scientific Disciplines; Health Care Sciences & Services","(Ethnic Groups/statistics & numerical data), (Hispanic Americans/statistics & numerical data), (European Continental Ancestry Group/statistics & numerical data), (Asian Americans/statistics & numerical data), (African Americans/statistics & numerical data), Humans, (Schools, Medical/statistics & numerical data), Medically Underserved Area, (Universities/statistics & numerical data), United States, Career Choice, (Minority Groups/statistics & numerical data), (Schools/statistics & numerical data), Cross-Sectional Studies, Female, (Students, Medical/statistics & numerical data), (Physicians/statistics & numerical data/supply & distribution), Male, School Admission Criteria",6,2,33.33,No,No
25075731,0024-6921,2014,The Journal of the Louisiana State Medical Society : official organ of the Louisiana State Medical Society,J La State Med Soc,United States,,,,Radiology case of the month: recurrent knee pain in a young athlete.,,-,-,,,"(Fibula/diagnostic imaging), (Musculoskeletal Pain/diagnostic imaging), (Tibia/diagnostic imaging), Humans, (Knee Joint/diagnostic imaging), Adult, Male, Athletes",2,1,50.00,Yes,No
25075728,0024-6921,2014,The Journal of the Louisiana State Medical Society : official organ of the Louisiana State Medical Society,J La State Med Soc,United States,,,,Hounsfield unit changes over time in contusions of the brain.,,-,-,,,"(Brain Contusion/diagnostic imaging/epidemiology), Time Factors, Humans, Tomography, X-Ray Computed, Female, Male, Retrospective Studies, (Louisiana/epidemiology)",4,2,50.00,Yes,No
25075601,0024-6921,2014,The Journal of the Louisiana State Medical Society : official organ of the Louisiana State Medical Society,J La State Med Soc,United States,,,,Radiology case of the month. 49-year-old female with an anterior mediastinal mass.,,-,-,,,"(Mediastinal Neoplasms/diagnostic imaging/therapy), (Hamartoma/diagnostic imaging/therapy), Middle Aged, Humans, (Giant Lymph Node Hyperplasia/diagnostic imaging/therapy), Tomography, X-Ray Computed, Female",5,2,40.00,Yes,No
25075593,0024-6921,2014,The Journal of the Louisiana State Medical Society : official organ of the Louisiana State Medical Society,J La State Med Soc,United States,,,,Elbow synovium as the initial site of colon adenocarcinoma metastasis: diagnosis by arthroscopic biopsy.,,-,-,,,"(Adenocarcinoma/pathology), Male, (Colonic Neoplasms/pathology), Humans, Arthroscopy, Biopsy, (Joint Diseases/pathology), (Elbow Joint/pathology), Neoplasm Metastasis, Aged, (Synovial Membrane/pathology)",2,1,50.00,Yes,No
25075510,0024-6921,2014,The Journal of the Louisiana State Medical Society : official organ of the Louisiana State Medical Society,J La State Med Soc,United States,,,,Radiology case of the month. Progressive slurring of speech and difficulty reading in a 62-year-old male. Final diagnosis: Metastatic small cell cancer of the prostate gland.,,-,-,,,"(Prostatic Neoplasms/diagnostic imaging), (Brain Neoplasms/diagnostic imaging/secondary), Middle Aged, Humans, Neoplasm Metastasis, (Speech Disorders/diagnostic imaging), Magnetic Resonance Imaging, Male, (Carcinoma, Small Cell/diagnostic imaging), (Dyslexia, Acquired/diagnostic imaging/etiology)",5,1,20.00,Yes,No
25073582,1527-330X,2014,Aesthetic surgery journal,Aesthet Surg J,England,2.697,1.792,2.602,Improvement in stress urinary incontinence after abdominoplasty.,2,-,"abdominoplasty, multiple births, urge incontinence, rectus plication, cesarean section, stress urinary incontinence, dermatolipectomy",Surgery,Surgery,"Aged, (Urinary Incontinence, Stress/diagnosis/physiopathology/surgery), Surveys and Questionnaires, Abdominoplasty, Middle Aged, Humans, Urodynamics, Young Adult, Recovery of Function, Adult, Female, Treatment Outcome, Health Care Surveys, Retrospective Studies",4,1,25.00,Yes,No
25072574,1938-808X,2014,Academic medicine : journal of the Association of American Medical Colleges,Acad Med,United States,5.255,4.453,4.901,Implementation of the Medical Education Partnership Initiative: medical students' perspective.,5,-,-,Education & Educational Research; Health Care Sciences & Services,"Education, Scientific Disciplines; Health Care Sciences & Services","(Education, Medical/organization & administration), United States, Organizational Objectives, (Students, Medical/psychology), International Cooperation, Curriculum, Humans, Diffusion of Innovation, (Schools, Medical/organization & administration), Models, Educational, Africa South of the Sahara",4,1,25.00,Yes,No
25065570,1534-4436,2014,"Annals of allergy, asthma & immunology : official publication of the American College of Allergy, Asthma, & Immunology",Ann. Allergy Asthma Immunol.,United States,3.728,3.298,3.23,Clinical presentation and referral characteristics of food protein-induced enterocolitis syndrome in the United Kingdom.,21,-,-,Allergy; Immunology,Allergy; Immunology,"Infant, (Enterocolitis/diagnosis/epidemiology/etiology), Humans, (Allergens/administration & dosage/classification/immunology), Retrospective Studies, Referral and Consultation, (United Kingdom/epidemiology), Child, (Food/adverse effects/classification), Child, Preschool, (Food Hypersensitivity/complications/diagnosis/epidemiology)",4,2,50.00,No,No
25062378,1357-6321,2014,International journal of palliative nursing,Int J Palliat Nurs,England,,,,Palliative care staff's perceptions of do not attempt cardiopulmonary resuscitation discussions.,,( Marie Curie / United Kingdom ),"Do-not-resuscitate orders, End-of-life care, Palliative care, Resuscitation, Hospices",,,"Palliative Care, Qualitative Research, Scotland, Cardiopulmonary Resuscitation, Humans, Terminal Care, State Medicine, Resuscitation Orders, Adult, Female, (Medical Staff/psychology), Attitude of Health Personnel, Male, Professional-Patient Relations, Decision Making",4,1,25.00,Yes,No
25058813,2168-6173,2014,JAMA ophthalmology,JAMA Ophthalmol,United States,5.625,5.237,5.425,Disorganization of the retinal inner layers as a predictor of visual acuity in eyes with center-involved diabetic macular edema.,34,-,-,Ophthalmology,Ophthalmology,"Fluorescein Angiography, (Diabetes Mellitus, Type 2/complications), (Diabetes Mellitus, Type 1/complications), (Macular Edema/physiopathology), Male, Tomography, Optical Coherence, (Vision Disorders/physiopathology), Middle Aged, Humans, Retrospective Studies, (Diabetic Retinopathy/physiopathology), (Retina/pathology), (Visual Acuity/physiology), Adult, Female, Aged, Follow-Up Studies, Biomarkers",7,2,28.57,No,No
25056910,1527-330X,2014,Aesthetic surgery journal,Aesthet Surg J,England,2.697,1.792,2.602,Breast striae after cosmetic augmentation.,1,-,"hormonal effects, scarring, striae, breast implants, breast augmentation, complications, risk factors",Surgery,Surgery,"Age Factors, Time Factors, Risk Assessment, Adolescent, Treatment Outcome, Prosthesis Design, Humans, Risk Factors, Breast Implants, Young Adult, Adult, Female, (Striae Distensae/diagnosis/etiology), (Breast Implantation/adverse effects/instrumentation), Retrospective Studies",3,1,33.33,No,No
25054415,1938-808X,2014,Academic medicine : journal of the Association of American Medical Colleges,Acad Med,United States,5.255,4.453,4.901,Assessing medical students' and residents' perceptions of the learning environment: exploring validity evidence for the interpretation of scores from existing tools.,13,-,-,Education & Educational Research; Health Care Sciences & Services,"Education, Scientific Disciplines; Health Care Sciences & Services","Education, Medical, Perception, Surveys and Questionnaires, Students, Medical, Humans, Psychometrics, Environment, Attitude, Learning, Schools, Medical, Internship and Residency, Reproducibility of Results",5,1,20.00,No,No
25053962,1735-8639,2014,Iranian journal of psychiatry and behavioral sciences,Iran J Psychiatry Behav Sci,Iran,,,,"Familial characteristics of street children in tehran, iran.",,-,"Tehran, Street Children, amilial Characteristics, Iran",,,-,5,1,20.00,No,No
25053961,1735-8639,2014,Iranian journal of psychiatry and behavioral sciences,Iran J Psychiatry Behav Sci,Iran,,,,"Drug Abuse among University Students of Rafsanjan, Iran.",,-,"Cigarette, Drug Abuse, Tobacco, Methylphenidate, Student",,,-,4,2,50.00,Yes,No
25052977,1681-7168,2014,Journal of the College of Physicians and Surgeons--Pakistan : JCPSP,J Coll Physicians Surg Pak,Pakistan,0.372,0.35,0.488,Are medical undergraduates more likely to indulge in substance abuse than non-medical undergraduates? A survey from Karachi.,1,-,-,General & Internal Medicine,"Medicine, General & Internal","(Alcohol Drinking/epidemiology), (Students, Medical/psychology/statistics & numerical data), Young Adult, Surveys and Questionnaires, (Substance-Related Disorders/epidemiology), Adolescent, Prevalence, Sex Distribution, Socioeconomic Factors, Humans, (Smoking/epidemiology), Adult, Female, Universities, Male, Risk Factors, (Students/psychology/statistics & numerical data), Cross-Sectional Studies",6,6,100.00,Yes,Yes
