26405451,1735-3955,2015,ARYA atherosclerosis,ARYA Atheroscler,Iran,,,,Effects of single antegrade hot shot in comparison with no hot shot administration during coronary artery bypass grafting.,0,-,"Reperfusion Injury, Coronary Artery Bypass, Stroke, Oxidative Stress, Induced, Mortality, Heart Arrest",Cardiovascular System & Cardiology,Cardiac & Cardiovascular Systems,-,2,1,50.00,Yes,No
26401148,1735-4668,2015,Iranian journal of child neurology,Iran J Child Neurol,Iran,,,,Measuring Serum Level of Ionized Magnesium in Patients with Migraine.,1,-,"Migraine, Serum ionized magnesium, Headache",Neurosciences & Neurology,Clinical Neurology,-,6,1,16.67,No,No
26400455,1440-1665,2016,Australasian psychiatry : bulletin of Royal Australian and New Zealand College of Psychiatrists,Australas Psychiatry,England,0.829,0.695,0.819,"Improving metabolic monitoring in patients maintained on antipsychotics in Penang, Malaysia.",0,-,"staff behaviour, waist circumference, mental disorders, antipsychotic agents, patient monitoring, Malaysia, cultural issues, metabolic monitoring, metabolic syndrome",Psychiatry,Psychiatry,"Male, Adolescent, Middle Aged, (Metabolic Syndrome X/diagnosis), (Mental Disorders/complications/drug therapy/metabolism), Humans, Outpatients, Clinical Audit, Malaysia, Young Adult, Focus Groups, Adult, Female, Aged, Waist Circumference, Risk Factors, (Antipsychotic Agents/therapeutic use)",9,1,11.11,Yes,No
26396971,2251-7200,2015,Journal of biomedical physics & engineering,J Biomed Phys Eng,Iran,,,,A Challenging Issue in the Etiology of Speech Problems: The Effect of Maternal Exposure to Electromagnetic Fields on Speech Problems in the Offspring.,,-,"Mobile Phones, Pregnancy, Maternal Exposure, Speech Problem, Electromagnetic Fields",,,-,12,1,8.33,No,No
26396970,2251-7200,2015,Journal of biomedical physics & engineering,J Biomed Phys Eng,Iran,,,,Does Occupational Exposure of Shahid Dastghieb International Airport Workers to Radiofrequency Radiation Affect Their Short Term Memory and Reaction Time?,,-,"Occupational Exposure, Cognitive Functions, Electromagnetic fields, Airport, Short Term Memory, Reaction Time",,,-,11,1,9.09,No,No
26396967,2251-7200,2015,Journal of biomedical physics & engineering,J Biomed Phys Eng,Iran,,,,"Klebsiella pneumonia, a Microorganism that Approves the Non-linear Responses to Antibiotics and Window Theory after Exposure to Wi-Fi 2.4 GHz Electromagnetic Radiofrequency Radiation.",,-,"Antibiogram, Klebsiella, Non-linearity, Dose Response, Adaptive Response",,,-,7,2,28.57,No,No
26396965,2251-7200,2015,Journal of biomedical physics & engineering,J Biomed Phys Eng,Iran,,,,New Horizons in Enhancing the Proliferation and Differentiation of Neural Stem Cells Using Stimulatory Effects of the Short Time Exposure to Radiofrequency Radiation.,,-,"Differentiation, Proliferation, Stem cell, Diseases, Radiofrequency (RF)",,,-,4,1,25.00,No,No
26393134,2249-782X,2015,Journal of clinical and diagnostic research : JCDR,J Clin Diagn Res,India,,,,Ovarian Sertoli-Leydig Cell Tumour with Heterologus Elements Masquerading as Mucinous Tumour on Frozen Section: A Case Report.,,-,"Sertoli cell, Ovarian neoplasms, Sex cord-stromal",,,-,4,1,25.00,No,No
26393114,2249-782X,2015,Journal of clinical and diagnostic research : JCDR,J Clin Diagn Res,India,,,,Bilateral Osseous Interclinoid Bridges Associated with Foramina of Vesalius: A Case Report.,,-,"Variations, Cranial foramina, Osseous bridges, Turcica sella, Clinoid processes",,,-,3,1,33.33,No,No
26388974,2008-5842,2015,Electronic physician,Electron Physician,Iran,,,,The correlation between end-tidal carbon dioxide and arterial blood gas parameters in patients evaluated for metabolic acid-base disorders.,,-,"acidosis, capnography, blood gas analysis",,,-,6,1,16.67,No,No
26385854,1758-2652,2015,Journal of the International AIDS Society,J Int AIDS Soc,Switzerland,,,,Barriers and facilitators adolescent females living with HIV face in accessing contraceptive services: a qualitative assessment of providers' perceptions in western Kenya.,,( NIAID NIH HHS / United States ),"Kenya, adolescents, contraception, HIV",,,"(HIV Infections/epidemiology/prevention & control/psychology), Perception, Adolescent, (Contraception/instrumentation), Evaluation Studies as Topic, Humans, (Sexual Partners/psychology), (Health Personnel/psychology), Sexual Behavior, Contraception Behavior, (Kenya/epidemiology), Adult, Female, Young Adult, Counseling, Male",6,1,16.67,Yes,No
26374812,1527-330X,2015,Aesthetic surgery journal,Aesthet Surg J,England,2.697,1.792,2.602,"Power-assisted gluteal augmentation: a new technique for sculpting, harvesting, and transferring fat.",4,-,-,Surgery,Surgery,"Combined Modality Therapy, Young Adult, (Buttocks/surgery), Time Factors, (Wound Healing/physiology), Risk Assessment, Middle Aged, Cohort Studies, Adult, Treatment Outcome, Body Mass Index, (Lipectomy/methods), (Postoperative Complications/physiopathology), (Transplantation, Autologous/adverse effects/methods), Esthetics, (Tissue and Organ Harvesting/methods), Male, Follow-Up Studies, Prospective Studies, (Adipose Tissue/transplantation), Humans, (Surgery, Plastic/adverse effects/methods), Female",3,1,33.33,No,No
26367358,1175-8716,2015,The New Zealand medical journal,N. Z. Med. J.,New Zealand,,,,Multidisciplinary operating room simulation-based team training to reduce treatment errors: a feasibility study in New Zealand hospitals.,,-,-,,,"Feasibility Studies, Cost-Benefit Analysis, Pilot Projects, (Patient Care Team/organization & administration), Program Evaluation, Communication, Curriculum, Humans, (Simulation Training/organization & administration), Models, Anatomic, (Operating Rooms/organization & administration), Adult, Female, New Zealand, Male",17,2,11.76,No,No
26363309,1873-4332,2016,Journal of pediatric and adolescent gynecology,J Pediatr Adolesc Gynecol,United States,1.576,1.391,1.76,Urban Adolescents' and Young Adults' Decision-Making Process around Selection of Intrauterine Contraception.,2,( NICHD NIH HHS / United States ),"Qualitative research, Adolescent, Contraception, Decision-making, Reproductive health, Intrauterine devices, Contraception decision-making, Counseling, Female",Obstetrics & Gynecology; Pediatrics,Obstetrics & Gynecology; Pediatrics,"Grounded Theory, Young Adult, Qualitative Research, Female, Adolescent, Humans, New York, Caregivers, Urban Population, (Intrauterine Devices/utilization), Adult, Choice Behavior, (Contraception/methods/psychology), Family Planning Services, Decision Making",4,1,25.00,No,No
26362549,2213-2201,2015,The journal of allergy and clinical immunology. In practice,J Allergy Clin Immunol Pract,United States,5.317,4.77,5.641,Pediatric Allergic Contact Dermatitis: Lessons for Better Care.,7,-,"Nickel, Atopic dermatitis, Sensitization, Pediatric, Allergic contact dermatitis, Children",Allergy; Immunology,Allergy; Immunology,"(Haptens/immunology), Animals, Humans, (Allergens/immunology), Immunization, Adult, (Patch Tests/methods), Child, (Nickel/immunology), (Dermatitis, Allergic Contact/diagnosis/therapy)",5,1,20.00,Yes,No
26348113,2168-6211,2015,JAMA pediatrics,JAMA Pediatr,United States,10.251,9.955,10.481,"Early Enhanced Parenteral Nutrition, Hyperglycemia, and Death Among Extremely Low-Birth-Weight Infants.",3,-,-,Pediatrics,Pediatrics,"Infant, Infant Mortality, (Parenteral Nutrition/adverse effects/methods), (Blood Glucose/analysis), Humans, Risk Factors, Infant, Extremely Low Birth Weight, (Hyperglycemia/etiology), Female, Logistic Models, Infant, Newborn, Male, Cohort Studies",7,1,14.29,No,No
26346211,1535-2900,2015,American journal of health-system pharmacy : AJHP : official journal of the American Society of Health-System Pharmacists,Am J Health Syst Pharm,United States,1.969,1.637,2.13,Alternative antiretroviral therapy formulations for patients unable to swallow solid oral dosage forms.,4,-,-,Pharmacology & Pharmacy,Pharmacology & Pharmacy,"Deglutition Disorders, Humans, (Anti-Retroviral Agents/therapeutic use), (HIV Infections/drug therapy), Evidence-Based Medicine, Dosage Forms",6,2,33.33,No,No
26345989,2090-6803,2015,Case reports in pediatrics,Case Rep Pediatr,United States,,,,Isolated Splenic Vein Thrombosis: 8-Year-Old Boy with Massive Upper Gastrointestinal Bleeding and Hypersplenism.,,-,-,,,-,7,1,14.29,No,No
26341682,1531-5053,2015,Journal of oral and maxillofacial surgery : official journal of the American Association of Oral and Maxillofacial Surgeons,J. Oral Maxillofac. Surg.,United States,1.916,1.677,1.873,A Histomorphometric Analysis of Radiation Damage in an Isogenic Murine Model of Distraction Osteogenesis.,2,"( NCI NIH HHS / United States ) , ( NHLBI NIH HHS / United States )",-,"Dentistry, Oral Surgery & Medicine","Dentistry, Oral Surgery & Medicine","(Mandible/pathology/radiation effects/surgery), Animals, Rats, Inbred Lew, Rats, (Radiation Injuries/pathology/surgery), Cell Count, Disease Models, Animal, Osteogenesis, Distraction, Male, (Osteocytes/pathology/radiation effects)",7,2,28.57,Yes,No
26333989,1527-330X,2015,Aesthetic surgery journal,Aesthet Surg J,England,2.697,1.792,2.602,Lightweight breast implants: a novel solution for breast augmentation and reconstruction mammaplasty.,2,-,-,Surgery,Surgery,"Weights and Measures, (Breast Implantation/adverse effects/methods), Risk Assessment, Middle Aged, Humans, Breast Implants, Esthetics, Adult, Female, Treatment Outcome, (Prosthesis Design/methods), (Mammaplasty/adverse effects/methods), Aged, Prosthesis Failure, Follow-Up Studies",5,1,20.00,No,No
26330985,2008-7802,2015,International journal of preventive medicine,Int J Prev Med,Iran,,,,"The Comparison of Under-5-year Nutritional Status among Fars-native, Turkman and Sistani Ethnic Groups in the North of Iran.",0,-,"sociodemographic, nutrition, Iran, Children",General & Internal Medicine,"Medicine, General & Internal",-,6,1,16.67,No,No
26330210,1472-6920,2015,BMC medical education,BMC Med Educ,England,1.572,1.416,1.929,Evaluating the validity of an integrity-based situational judgement test for medical school admissions.,3,-,-,Education & Educational Research,"Education & Educational Research; Education, Scientific Disciplines","Surveys and Questionnaires, Female, Adolescent, (Judgment/ethics), Humans, Psychometrics, Reproducibility of Results, Interviews as Topic, College Admission Test, Male, Morals, Personality Inventory",4,1,25.00,No,No
26321485,1872-8243,2015,International journal of medical informatics,Int J Med Inform,Ireland,3.21,2.702,3.287,Assessing acceptability of hypertensive/diabetic patients towards mobile health based behavioral interventions in Pakistan: A pilot study.,4,-,"Mobile health, Hypertension, Diabetes",Computer Science; Health Care Sciences & Services; Medical Informatics,"Computer Science, Information Systems; Health Care Sciences & Services; Medical Informatics","(Reminder Systems/utilization), (Telemedicine/methods/statistics & numerical data), Health Behavior, Interviews as Topic, Male, (Diabetes Mellitus, Type 1/epidemiology/psychology), Cell Phones, Middle Aged, Pilot Projects, Humans, Telephone, (Diabetes Mellitus, Type 2/epidemiology/psychology), Text Messaging, (Pakistan/epidemiology), Adult, Female, Aged, Hospitals, (Hypertension/epidemiology/psychology), Attitude to Health",10,7,70.00,Yes,No
26312257,2319-9644,2015,Journal of research in pharmacy practice,J Res Pharm Pract,India,,,,Outcome of treatment in patients with methamphetamine poisoning in an Iranian tertiary care referral center.,1,-,"poisoning, Methamphetamine, treatment outcome",Pharmacology & Pharmacy,Pharmacology & Pharmacy,-,5,1,20.00,No,No
26311649,2045-2098,2016,The journal of family planning and reproductive health care,J Fam Plann Reprod Health Care,England,1.519,1.253,1.503,Views of general practitioners on providing contraceptive advice and long-acting reversible contraception at the 6-week postnatal visit: a qualitative study.,1,-,"qualitative research, family planning service provision, postpartum, general practice, unintended pregnancy, long-acting reversible contraception",Family Studies; Obstetrics & Gynecology; Biomedical Social Sciences,"Family Studies; Obstetrics & Gynecology; Social Sciences, Biomedical","Time Factors, (Postnatal Care/methods), Postpartum Period, Qualitative Research, Interviews as Topic, Pregnancy Rate, (Practice Patterns, Physicians'/standards/trends), Needs Assessment, Humans, Pregnancy, Pregnancy, Unplanned, United Kingdom, (General Practitioners/statistics & numerical data), (Contraceptive Agents, Female/administration & dosage), Adult, Female, (General Practice/methods), (Directive Counseling/methods), Attitude of Health Personnel, Patient Education as Topic, Male",3,1,33.33,Yes,No
26310409,0310-057X,2015,Anaesthesia and intensive care,Anaesth Intensive Care,Australia,1.695,1.327,1.795,Factors associated with vancomycin nephrotoxicity in the critically ill.,8,-,"acute kidney injury, vancomycin, sepsis, infection, intensive care unit, glycopeptide",Anesthesiology; General & Internal Medicine,Anesthesiology; Critical Care Medicine,"(Acute Kidney Injury/chemically induced), Male, Critical Illness, Middle Aged, (Vancomycin/adverse effects), Humans, Adult, Female, Logistic Models, APACHE, Aged, (Anti-Bacterial Agents/adverse effects)",7,1,14.29,No,No
26309435,1658-3639,2015,International journal of health sciences,Int J Health Sci (Qassim),Saudi Arabia,,,,"Patients' Satisfaction with Primary Health Care Centers' Services, Majmaah, Kingdom of Saudi of Saudi Arabia.",1,-,"Satisfaction, Patients, Primary health care centers",General & Internal Medicine,"Medicine, General & Internal",-,6,4,66.67,No,No
26308126,1938-808X,2015,Academic medicine : journal of the Association of American Medical Colleges,Acad Med,United States,5.255,4.453,4.901,"A Study of the Use, Knowledge, and Beliefs About Cigarettes and Alternative Tobacco Products Among Students at One U.S. Medical School.",4,"( NCI NIH HHS / United States ) , ( NIEHS NIH HHS / United States )",-,Education & Educational Research; Health Care Sciences & Services,"Education, Scientific Disciplines; Health Care Sciences & Services","Young Adult, (Students, Medical/psychology), (Smoking/adverse effects/epidemiology), (Smoking Cessation/methods/psychology), New York City, Humans, Health Knowledge, Attitudes, Practice, (Tobacco/adverse effects), Cross-Sectional Studies, Female, Schools, Medical, Male, (Electronic Cigarettes/statistics & numerical data)",6,1,16.67,No,No
26306680,0736-4679,2015,The Journal of emergency medicine,J Emerg Med,United States,1.21,1.125,1.345,Efficacy of Noncontrast Computed Tomography of the Abdomen and Pelvis for Evaluating Nontraumatic Acute Abdominal Pain in the Emergency Department.,0,-,"emergency department, nontraumatic, noncontrast CT, emergency, abdominal pain, acute abdominal pain, ED, noncontrast computed tomography, computed tomography, CT",Emergency Medicine,Emergency Medicine,"Aged, Prospective Studies, Male, Middle Aged, Humans, Diagnosis, Differential, (Abdominal Pain/diagnostic imaging), (Radiography, Abdominal/methods), Adult, Female, Emergency Service, Hospital, (Tomography, X-Ray Computed/methods), Acute Disease",8,3,37.50,No,No
26305313,1681-7168,2015,Journal of the College of Physicians and Surgeons--Pakistan : JCPSP,J Coll Physicians Surg Pak,Pakistan,0.372,0.35,0.488,Unilateral Ectrodactyly in a Newborn with Trisomy 18 Syndrome: An Unusual Association.,0,-,-,General & Internal Medicine,"Medicine, General & Internal","(Chromosomes, Human, Pair 18/genetics), Radiography, Infant, Small for Gestational Age, (Hand Deformities, Congenital/diagnostic imaging/genetics), (Fingers/abnormalities), Humans, (Limb Deformities, Congenital/diagnosis/genetics), (Lower Extremity Deformities, Congenital/diagnosis/genetics), (Foot/diagnostic imaging), (Trisomy/genetics), Infant, Newborn, Male",6,1,16.67,No,No
26266152,2249-782X,2015,Journal of clinical and diagnostic research : JCDR,J Clin Diagn Res,India,,,,A Challenging Diagnosis of Fluctuating Dyspnea: Myasthenia Gravis.,,-,"Respiratory muscles weakness, Single fiber electromyography, Muscle weakness",,,-,5,1,20.00,No,No
26266065,2090-6668,2015,Case reports in neurological medicine,Case Rep Neurol Med,United States,,,,Endoscopic Transnasal Approach for Cholesterol Granuloma of the Petrous Apex.,,-,-,,,-,5,1,20.00,No,No
26261117,1469-5804,2015,"Education for health (Abingdon, England)",Educ Health (Abingdon),India,,,,Telemedicine in education: bridging the gap.,,-,-,,,"(Health Services Accessibility/economics/standards/trends), Humans, Medically Underserved Area, International Cooperation, (International Educational Exchange/economics/trends), (Education, Medical/economics/methods/trends), (Telemedicine/economics/standards/trends), Students, Medical",4,1,25.00,Yes,No
26259692,1531-5053,2016,Journal of oral and maxillofacial surgery : official journal of the American Association of Oral and Maxillofacial Surgeons,J. Oral Maxillofac. Surg.,United States,1.916,1.677,1.873,Are There Clinical or Pathological Parameters of Maxillary Oral Squamous Cell Carcinoma With an Influence on the Occurrence of Neck Node Metastasis? An Appraisal of 92 Patients.,2,-,-,"Dentistry, Oral Surgery & Medicine","Dentistry, Oral Surgery & Medicine","(Lymphatic Metastasis/pathology), (Neck Dissection/methods), Neoplasm Grading, Middle Aged, Cohort Studies, Neoadjuvant Therapy, Retrospective Studies, (Neoplasm Recurrence, Local/pathology), Chemotherapy, Adjuvant, (Neck/pathology), (Maxillary Neoplasms/pathology), Neoplasm Staging, Male, Follow-Up Studies, Forecasting, Cause of Death, (Carcinoma, Squamous Cell/pathology/secondary), (Lymph Nodes/pathology), Humans, (Palatal Neoplasms/pathology), Female, Radiotherapy, Adjuvant, Aged, Risk Factors",9,1,11.11,No,No
26246524,0036-9330,2016,Scottish medical journal,Scott Med J,Scotland,0.51,0.51,0.667,Unilateral cancer-associated retinopathy: a case report.,1,-,"CAR, retina, autoimmune, Cancer-associated retinopathy, unilateral",General & Internal Medicine,"Medicine, General & Internal","(Paraneoplastic Syndromes, Ocular/etiology/pathology), Neoplasm Recurrence, Local, (Steroids/administration & dosage), (Autoantigens/immunology), Humans, (Retinal Diseases/etiology/pathology), (Retina/pathology), (Uterine Cervical Neoplasms/complications/pathology), Adult, Female, (Cervical Intraepithelial Neoplasia/complications/pathology), Treatment Outcome, (Vision Disorders/etiology/pathology), Injections, Intraocular",4,2,50.00,Yes,No
26242505,0256-9574,2014,South African medical journal = Suid-Afrikaanse tydskrif vir geneeskunde,S. Afr. Med. J.,South Africa,1.731,1.438,1.931,The unsuspected killer: Liquefied petroleum gas overexposure in South Africa.,0,-,-,General & Internal Medicine,"Medicine, General & Internal","(Cardiopulmonary Resuscitation/methods), (Butanes/poisoning), (Fossil Fuels/poisoning), Humans, (Inhalation Exposure/adverse effects), Young Adult, Female, (Propane/poisoning), (Gas Poisoning/therapy)",3,1,33.33,Yes,No
26240244,1544-5208,2015,Health affairs (Project Hope),Health Aff (Millwood),United States,4.98,4.523,5.626,"For many patients who use large amounts of health care services, the need is intense yet temporary.",30,( PHS HHS / United States ),"Determinants Of Health, Safety-Net Systems, Cost of Health Care, Organization and Delivery of Care, Health Spending",Health Care Sciences & Services,Health Care Sciences & Services; Health Policy & Services,"(Health Services/utilization), Socioeconomic Factors, Health Services Accessibility, Colorado, Longitudinal Studies, (Hospital Charges/trends), Medically Uninsured, Health Expenditures, Humans, Urban Population, Cross-Sectional Studies, (Hospitalization/economics/trends), Adult",9,1,11.11,No,No
26240242,1544-5208,2015,Health affairs (Project Hope),Health Aff (Millwood),United States,4.98,4.523,5.626,"In California, not-for-profit hospitals spent more operating expenses on charity care than for-profit hospitals spent.",1,-,"Nonprofit/For-Profit Status, Safety-Net, Access To Care, Business Of Health",Health Care Sciences & Services,Health Care Sciences & Services; Health Policy & Services,"Models, Statistical, State Government, Socioeconomic Factors, Humans, (Hospital Costs/statistics & numerical data), (Hospitals, Voluntary/economics), California, Budgets, Health Care Surveys, (Uncompensated Care/economics)",3,1,33.33,No,No
26237469,2168-6211,2015,JAMA pediatrics,JAMA Pediatr,United States,10.251,9.955,10.481,Same-Hospital Readmission Rates as a Measure of Pediatric Quality of Care.,17,( AHRQ HHS / United States ),-,Pediatrics,Pediatrics,"Infant, Quality Indicators, Health Care, Adolescent, Prevalence, (Hospitals/statistics & numerical data), Humans, (Patient Readmission/statistics & numerical data), Risk Factors, (New York/epidemiology), Female, Child, Infant, Newborn, (Pediatrics/statistics & numerical data), Male, Child, Preschool",7,1,14.29,No,No
26234973,1916-9736,2015,Global journal of health science,Glob J Health Sci,Canada,,,,Effect of Percutaneous Coronary Intervention on Left Ventricular Diastolic Function in Patients With Coronary Artery Disease.,,-,-,,,"(Ventricular Dysfunction, Left/complications/physiopathology/therapy), Diastole, Iran, Male, Echocardiography, Middle Aged, Humans, Percutaneous Coronary Intervention, Adult, Female, Treatment Outcome, Aged, (Coronary Disease/complications/physiopathology/therapy), Stroke Volume",7,1,14.29,No,No
26233506,0315-162X,2015,The Journal of rheumatology,J. Rheumatol.,Canada,3.15,2.903,3.293,Comparison of Photo Optical Imaging with Musculoskeletal Ultrasound and Clinical Examination in the Assessment of Inflammatory Activity in Proximal Interphalangeal Joints in Rheumatoid Arthritis and Osteoarthritis.,1,-,"RHEUMATOID ARTHRITIS, OSTEOARTHRITIS, MUSCULOSKELETAL ULTRASOUND, LIGHTSCAN, PHOTO OPTICAL IMAGING",Rheumatology,Rheumatology,"Sensitivity and Specificity, Male, (Arthritis, Rheumatoid/diagnosis/diagnostic imaging), Middle Aged, (Finger Joint/diagnostic imaging), Humans, (Inflammation/diagnosis/diagnostic imaging), (Osteoarthritis/diagnosis/diagnostic imaging), Severity of Illness Index, Aged, 80 and over, (Synovitis/diagnosis/diagnostic imaging), Adult, Female, Young Adult, Ultrasonography, Aged, Physical Examination, (Optical Imaging/methods)",8,1,12.50,Yes,No
26232115,1087-2981,2015,Medical education online,Med Educ Online,United States,1.096,1.052,1.531,Tackling student neurophobia in neurosciences block with team-based learning.,4,-,"small group teaching, team-based learning, neurophobia, neurosciences block",Education & Educational Research,Education & Educational Research,"Group Processes, (Students, Medical/psychology), Cooperative Behavior, Curriculum, Humans, Sex Factors, (Neurosciences/education), Female, (Problem-Based Learning/organization & administration), (Education, Medical, Undergraduate/organization & administration), Male, Educational Measurement",6,1,16.67,No,No
26228347,0030-9982,2015,JPMA. The Journal of the Pakistan Medical Association,J Pak Med Assoc,Pakistan,0.616,0.553,0.657,Role of pelvic X-ray in blunt trauma patients -- A university hospital experience in Oman.,0,-,"Pelvic x-ray, Computed tomography, CT, Stable, blunt trauma, ATLS, Advanced Trauma Life Support.",General & Internal Medicine; Research & Experimental Medicine,"Medicine, General & Internal; Medicine, Research & Experimental","(Lumbar Vertebrae/diagnostic imaging/injuries), Male, (Fractures, Bone/diagnostic imaging), Adolescent, Radiography, Hospitals, University, Middle Aged, Cohort Studies, Humans, (Femoral Fractures/diagnostic imaging), (Multiple Trauma/diagnostic imaging), Tomography, X-Ray Computed, (Wounds, Nonpenetrating/diagnostic imaging), Young Adult, (Pelvic Bones/diagnostic imaging/injuries), Adult, Female, Oman, (Spinal Fractures/diagnostic imaging), Aged, Prospective Studies",2,1,50.00,Yes,No
26228324,0030-9982,2015,JPMA. The Journal of the Pakistan Medical Association,J Pak Med Assoc,Pakistan,0.616,0.553,0.657,"Frequency of using non-prescribed medication in Majmaah city, Saudi Arabia -- A cross sectional study.",1,-,"Non-prescribed medication, Saudi population, Self-medication, Majmaah community.",General & Internal Medicine; Research & Experimental Medicine,"Medicine, General & Internal; Medicine, Research & Experimental","Saudi Arabia, Male, Surveys and Questionnaires, Adolescent, (Antipyretics/therapeutic use), Humans, Educational Status, (Self Medication/statistics & numerical data), (Anti-Bacterial Agents/therapeutic use), Sex Factors, (Analgesics/therapeutic use), Aged, 80 and over, Adult, Female, Middle Aged, Young Adult, Aged, Risk Factors, Cross-Sectional Studies",5,3,60.00,No,No
26226111,1873-507X,2015,Physiology & behavior,Physiol. Behav.,United States,2.341,2.139,2.835,Protective effect of exercise and sildenafil on acute stress and cognitive function.,6,-,"Chronic exercise, Acute stress, Sildenafil",Psychology; Behavioral Sciences,"Psychology, Biological; Behavioral Sciences","(Physical Conditioning, Animal/physiology/psychology), (Sildenafil Citrate/pharmacology), (Anxiety Disorders/physiopathology/therapy), Animals, (Recognition (Psychology)/drug effects/physiology), Male, (Exploratory Behavior/drug effects/physiology), (Stress, Psychological/physiopathology/therapy), (Malondialdehyde/metabolism), (Exercise Therapy/methods), (Peroxidase/metabolism), (Psychotropic Drugs/pharmacology), (Swimming/physiology/psychology), (Cognition/drug effects/physiology), Rats, Wistar, Disease Models, Animal, Treatment Outcome, Acute Disease, Random Allocation, (Nitric Oxide/metabolism), (Hippocampus/drug effects/physiopathology)",8,4,50.00,No,No
